{
  "$schema": "http://json-schema.org/draft-07/schema#",
  "$id": "https://tensorplate.com/schemas/v0.1/lifecycle_report.json",
  "title": "Lifecycle validation report",
  "description": "One harness run against one support row. Written by tools/validation/lifecycle-stages.sh and consumed by evidence-bundle assembly, which decides completeness from the stage set rather than from prose.",
  "type": "object",
  "additionalProperties": false,
  "definitions": {
    "reboot_sub_case": {
      "type": "object",
      "additionalProperties": false,
      "required": [
        "status",
        "log"
      ],
      "properties": {
        "status": {
          "enum": [
            "pass",
            "fail",
            "skipped"
          ]
        },
        "log": {
          "type": "string",
          "description": "The sub-case's log, relative to the report. Attached whether it ran or not.",
          "minLength": 1
        },
        "detail": {
          "type": "string",
          "description": "Why the sub-case failed or was skipped. Required for both."
        }
      },
      "if": {
        "properties": {
          "status": {
            "enum": [
              "fail",
              "skipped"
            ]
          }
        },
        "required": [
          "status"
        ]
      },
      "then": {
        "required": [
          "detail"
        ]
      }
    }
  },
  "required": [
    "schema_version",
    "row_id",
    "subject",
    "started_at",
    "finished_at",
    "outcome",
    "stages"
  ],
  "properties": {
    "schema_version": {
      "type": "string",
      "const": "0.1"
    },
    "row_id": {
      "type": "string",
      "description": "The support row this run validates. A report whose row is not in the registry is evidence for nothing.",
      "minLength": 1
    },
    "subject": {
      "type": "object",
      "description": "What was actually installed and exercised. A report that does not say what it tested cannot authorize a release: without it a run filed under one version silently blesses every later tag.",
      "additionalProperties": false,
      "required": [
        "tested_version"
      ],
      "properties": {
        "tested_version": {
          "type": "string",
          "description": "The release version this run authorizes, as the release workflow resolves it (`meta.outputs.version`) -- always bare X.Y.Z, including when the artifacts under test came from a candidate. NOT the package version string: a candidate's .deb reports 0.2.1~rc.1 and its wheel 0.2.1rc1, and recording either here would be recording which build was installed rather than which release the evidence stands for. That fact belongs in artifact_digest. The `~` form is deliberately outside the pattern so it cannot be filed here by accident.",
          "pattern": "^[0-9]+\\.[0-9]+\\.[0-9]+(-[0-9A-Za-z.-]+)?$"
        },
        "source_revision": {
          "type": "string",
          "description": "Full git SHA of the source the tested artifacts were built from, when the harness can determine it.",
          "pattern": "^[0-9a-f]{40}$"
        },
        "artifact_digest": {
          "type": "string",
          "description": "sha256 of the one immutable artifact the install verified, recorded by the harness while the run was happening. Binds the report to specific bytes rather than to a version string anyone can reuse. Which artifact that is depends on how the row installs: for a package channel it is the release's signed SHA256SUMS, which commits transitively to every package installed; for a build-from-source channel it is the archive every formula is pinned to, which is that channel's only immutable artifact -- and therefore names the build input, not the bytes that landed. The harness records what it hashed in `artifact-digest.txt` beside the stage logs, since this object is closed and cannot carry it. Bare lowercase hex: the `sha256:`-prefixed spelling used for model artifacts is deliberately outside the pattern so the two cannot be confused. Optional, because a report is worth filing from a harness that cannot determine it -- but a value not captured during the run cannot be recovered afterwards, since nothing on an installed system reports which artifact it came from.",
          "pattern": "^[0-9a-f]{64}$"
        }
      }
    },
    "harness": {
      "type": "string",
      "description": "Which harness produced this run, for reproducing it.",
      "minLength": 1
    },
    "started_at": {
      "type": "string",
      "format": "date-time"
    },
    "finished_at": {
      "type": "string",
      "format": "date-time"
    },
    "outcome": {
      "enum": [
        "pass",
        "fail",
        "incomplete"
      ],
      "description": "pass only when all eight canonical stages are present and passed and, if the report carries the reboot stage, it passed too. fail when any stage failed, the reboot stage included. incomplete when nothing failed but the eight are not all present and passing -- a deliberate skip is not a breakage, and conflating the two would either hide a gap or invent a failure. Only pass satisfies the release gate."
    },
    "reboot": {
      "type": "object",
      "description": "The reboot stage: a stage beside the canonical eight, not one of them, because only some rows at some versions run it and every other report must stay exactly as it is. It crosses a host reboot (the runner persists the run across it) and asserts, in this order because each consumes the state the one before leaves, that with the machine's cloud metadata blocked the agent fails closed after its retry window (blocked), that lifting the block inside the window recovers the committed set with no reprovisioning (transient), and that denied-egress operation then resumes within the new boot (denied_egress_resumes). Absent from a report, it was not run; the release gate decides which rows and versions require it.",
      "additionalProperties": false,
      "required": [
        "status",
        "started_at",
        "finished_at",
        "log",
        "boot_id_changed",
        "sub_cases"
      ],
      "properties": {
        "status": {
          "enum": [
            "pass",
            "fail"
          ],
          "description": "pass only when the boot ID changed, all three sub-cases passed and the retry window was recorded. There is no skipped: a reboot stage that did not run is absent, never present and skipped."
        },
        "started_at": {
          "type": "string",
          "format": "date-time"
        },
        "finished_at": {
          "type": "string",
          "format": "date-time"
        },
        "log": {
          "type": "string",
          "description": "The stage's log, relative to the report.",
          "minLength": 1
        },
        "detail": {
          "type": "string",
          "description": "Why the stage failed. Required when it did."
        },
        "boot_id_changed": {
          "type": "boolean",
          "description": "Whether the kernel boot ID after the reboot differs from the one recorded before it. false means no reboot happened, whatever else passed."
        },
        "retry_window_seconds": {
          "type": "number",
          "exclusiveMinimum": 0,
          "description": "The agent's metadata retry window as the run observed it, in seconds. Absent when the run never reached a point where it could be observed, and then the stage failed."
        },
        "sub_cases": {
          "type": "object",
          "description": "The three sub-cases, each present whether it ran or not, so a report cannot quietly leave one out.",
          "additionalProperties": false,
          "required": [
            "blocked",
            "transient",
            "denied_egress_resumes"
          ],
          "properties": {
            "blocked": {
              "$ref": "#/definitions/reboot_sub_case"
            },
            "transient": {
              "$ref": "#/definitions/reboot_sub_case"
            },
            "denied_egress_resumes": {
              "$ref": "#/definitions/reboot_sub_case"
            }
          }
        }
      },
      "if": {
        "properties": {
          "status": {
            "const": "fail"
          }
        },
        "required": [
          "status"
        ]
      },
      "then": {
        "required": [
          "detail"
        ]
      }
    },
    "stages": {
      "type": "array",
      "minItems": 1,
      "items": {
        "type": "object",
        "additionalProperties": false,
        "required": [
          "stage",
          "status",
          "log"
        ],
        "properties": {
          "stage": {
            "enum": [
              "install",
              "upgrade",
              "deploy-smoke",
              "status-logs",
              "rollback",
              "restart",
              "crash-loop",
              "offline"
            ],
            "description": "The eight lifecycle stages. A closed set so a report missing one is detectable rather than merely shorter."
          },
          "status": {
            "enum": [
              "pass",
              "fail",
              "skipped"
            ]
          },
          "started_at": {
            "type": "string",
            "format": "date-time",
            "description": "When the stage began. Present only for a stage that ran."
          },
          "finished_at": {
            "type": "string",
            "format": "date-time",
            "description": "When the stage ended. Present only for a stage that ran."
          },
          "log": {
            "type": "string",
            "description": "Log file for this stage, relative to the report. Attached whether the stage passed or failed: a passing stage's log is what a later regression is diffed against.",
            "minLength": 1
          },
          "detail": {
            "type": "string",
            "description": "Why a stage failed or was skipped. Required for both, since an unexplained skip is indistinguishable from an omission."
          }
        },
        "allOf": [
          {
            "if": {
              "properties": {
                "status": {
                  "enum": [
                    "fail",
                    "skipped"
                  ]
                }
              },
              "required": [
                "status"
              ]
            },
            "then": {
              "required": [
                "detail"
              ]
            }
          },
          {
            "if": {
              "properties": {
                "status": {
                  "enum": [
                    "pass",
                    "fail"
                  ]
                }
              },
              "required": [
                "status"
              ]
            },
            "then": {
              "required": [
                "started_at",
                "finished_at"
              ]
            }
          }
        ]
      }
    }
  }
}
